{
  "schemaVersion": "1.0.0",
  "recordId": "interlockgo-business-facts",
  "publicBusinessName": {
    "value": "InterlockGo NOCO",
    "status": "confirmed",
    "classification": "public",
    "sources": [
      {
        "title": "InterlockGo homepage",
        "url": "https://interlockgo.io/",
        "authorityLevel": "3-interlockgo-policy",
        "verifiedOn": "2026-08-27"
      }
    ]
  },
  "ownershipContext": {
    "value": "Owned and managed by Anson Cordeiro. The approved legal-entity wording has not yet been supplied for this catalog.",
    "status": "needs-owner-confirmation",
    "classification": "staff-only",
    "sources": [
      {
        "title": "Interlock Go BBB Business Profile",
        "url": "https://www.bbb.org/us/co/evans/profile/interlock-device/interlock-go-evans-co-0805-46145892",
        "authorityLevel": "5-topic-signal",
        "verifiedOn": "2026-08-27"
      }
    ]
  },
  "address": {
    "streetAddress": "3610 35th Avenue",
    "unit": "Unit 7",
    "locality": "Evans",
    "region": "CO",
    "postalCode": "80620",
    "country": "US",
    "publicDisplay": "3610 35th Avenue, Unit 7, Evans, CO 80620",
    "arrivalNote": "The garage entrance is at the rear of the building.",
    "status": "confirmed",
    "classification": "public",
    "sources": [
      {
        "title": "InterlockGo contact page",
        "url": "https://interlockgo.io/contactus/",
        "authorityLevel": "3-interlockgo-policy",
        "verifiedOn": "2026-08-27"
      },
      {
        "title": "LifeSafer Evans location",
        "url": "https://www.lifesafer.com/locations/colorado/evans/1939l/",
        "authorityLevel": "2-provider",
        "verifiedOn": "2026-08-27"
      },
      {
        "title": "Guardian Evans location",
        "url": "https://www.guardianinterlock.com/locations/colorado/evans/",
        "authorityLevel": "2-provider",
        "verifiedOn": "2026-08-27"
      }
    ]
  },
  "phones": [
    {
      "id": "shop-primary",
      "numberE164": "+19705155740",
      "display": "970-515-5740",
      "channels": ["voice"],
      "purpose": "Direct InterlockGo shop line for appointments, local service questions, installation, calibration, and removal scheduling.",
      "provider": "InterlockGo",
      "status": "confirmed",
      "classification": "public",
      "ownerConfirmedOn": "2026-08-27",
      "sources": [
        {
          "title": "InterlockGo contact page",
          "url": "https://interlockgo.io/contactus/",
          "authorityLevel": "3-interlockgo-policy",
          "verifiedOn": "2026-08-27"
        },
        {
          "title": "Interlock Go BBB Business Profile",
          "url": "https://www.bbb.org/us/co/evans/profile/interlock-device/interlock-go-evans-co-0805-46145892",
          "authorityLevel": "5-topic-signal",
          "verifiedOn": "2026-08-27"
        }
      ]
    },
    {
      "id": "shop-text",
      "numberE164": "+19702391354",
      "display": "970-239-1354",
      "channels": ["sms"],
      "purpose": "InterlockGo Google Voice text line for scheduling and local service questions.",
      "provider": "InterlockGo",
      "status": "confirmed",
      "classification": "public",
      "ownerConfirmedOn": "2026-08-27",
      "sources": [
        {
          "title": "InterlockGo contact page",
          "url": "https://interlockgo.io/contactus/",
          "authorityLevel": "3-interlockgo-policy",
          "verifiedOn": "2026-08-27"
        }
      ]
    },
    {
      "id": "lifesafer-evans-listing",
      "numberE164": "+19708121994",
      "display": "970-812-1994",
      "channels": ["voice"],
      "purpose": "LifeSafer enrollment or location-tracking line displayed for the Evans service center; whether and where it routes has not been confirmed by InterlockGo.",
      "provider": "LifeSafer",
      "status": "external-conflict",
      "classification": "public",
      "sources": [
        {
          "title": "LifeSafer Evans location",
          "url": "https://www.lifesafer.com/locations/colorado/evans/1939l/",
          "authorityLevel": "2-provider",
          "verifiedOn": "2026-08-27"
        }
      ]
    },
    {
      "id": "guardian-evans-listing",
      "numberE164": "+19703683466",
      "display": "970-368-3466",
      "channels": ["voice"],
      "purpose": "Guardian enrollment or location-tracking line displayed for the Evans service center; whether and where it routes has not been confirmed by InterlockGo.",
      "provider": "Guardian",
      "status": "external-conflict",
      "classification": "public",
      "sources": [
        {
          "title": "Guardian Evans location",
          "url": "https://www.guardianinterlock.com/locations/colorado/evans/",
          "authorityLevel": "2-provider",
          "verifiedOn": "2026-08-27"
        }
      ]
    },
    {
      "id": "lifesafer-customer-support",
      "numberE164": "+18006343077",
      "display": "800-634-3077",
      "channels": ["voice"],
      "purpose": "LifeSafer provider customer support for device, account, lockout, mechanic-code, and provider-program issues.",
      "provider": "LifeSafer",
      "status": "confirmed",
      "classification": "public",
      "sources": [
        {
          "title": "LifeSafer troubleshooting",
          "url": "https://www.lifesafer.com/troubleshooting/",
          "authorityLevel": "2-provider",
          "verifiedOn": "2026-08-27"
        }
      ]
    },
    {
      "id": "guardian-customer-support",
      "numberE164": "+18004990994",
      "display": "800-499-0994",
      "channels": ["voice"],
      "purpose": "Guardian 24/7 bilingual provider customer support and enrollment line.",
      "provider": "Guardian",
      "status": "confirmed",
      "classification": "public",
      "sources": [
        {
          "title": "Guardian Evans location",
          "url": "https://www.guardianinterlock.com/locations/colorado/evans/",
          "authorityLevel": "2-provider",
          "verifiedOn": "2026-08-27"
        }
      ]
    }
  ],
  "hours": {
    "timezone": "America/Denver",
    "status": "confirmed",
    "classification": "public",
    "regular": {
      "Monday": {"open": "08:00", "close": "18:00"},
      "Tuesday": null,
      "Wednesday": {"open": "08:00", "close": "18:00"},
      "Thursday": null,
      "Friday": {"open": "08:00", "close": "18:00"},
      "Saturday": {"open": "08:00", "close": "14:00"},
      "Sunday": null
    },
    "appointmentRequired": true,
    "scheduledExceptions": [
      {
        "dayOfWeek": "Tuesday",
        "service": "Ignition interlock installation only",
        "availability": "By advance appointment only; not regular open hours",
        "status": "confirmed"
      },
      {
        "dayOfWeek": "Thursday",
        "service": "Ignition interlock installation only",
        "availability": "By advance appointment only; not regular open hours",
        "status": "confirmed"
      }
    ],
    "ownerConfirmedOn": "2026-08-27",
    "externalListingConflict": "LifeSafer lists Tuesday and Thursday 8:00 AM-6:00 PM, and Guardian displayed the Evans location open Thursday 8:00 AM-6:00 PM on 2026-08-27. Those listings do not represent InterlockGo's regular hours; Tuesday and Thursday installations are available only by advance appointment.",
    "sources": [
      {
        "title": "InterlockGo hours",
        "url": "https://interlockgo.io/hours/",
        "authorityLevel": "3-interlockgo-policy",
        "verifiedOn": "2026-08-27"
      },
      {
        "title": "LifeSafer Evans location",
        "url": "https://www.lifesafer.com/locations/colorado/evans/1939l/",
        "authorityLevel": "2-provider",
        "verifiedOn": "2026-08-27"
      },
      {
        "title": "Guardian Evans location",
        "url": "https://www.guardianinterlock.com/locations/colorado/evans/",
        "authorityLevel": "2-provider",
        "verifiedOn": "2026-08-27"
      },
      {
        "title": "Interlock Go BBB Business Profile",
        "url": "https://www.bbb.org/us/co/evans/profile/interlock-device/interlock-go-evans-co-0805-46145892",
        "authorityLevel": "5-topic-signal",
        "verifiedOn": "2026-08-27"
      }
    ]
  },
  "holidayExceptions": [],
  "supportedProviders": [
    {
      "name": "LifeSafer",
      "status": "confirmed",
      "classification": "public",
      "sources": [
        {
          "title": "LifeSafer Evans location",
          "url": "https://www.lifesafer.com/locations/colorado/evans/1939l/",
          "authorityLevel": "2-provider",
          "verifiedOn": "2026-08-27"
        }
      ]
    },
    {
      "name": "Guardian",
      "status": "confirmed",
      "classification": "public",
      "sources": [
        {
          "title": "Guardian Evans location",
          "url": "https://www.guardianinterlock.com/locations/colorado/evans/",
          "authorityLevel": "2-provider",
          "verifiedOn": "2026-08-27"
        }
      ]
    }
  ],
  "supportedDeviceModels": [
    {
      "provider": "LifeSafer",
      "models": ["L250 or LS250 (name needs reconciliation)", "FC100 or LC100 (name needs reconciliation)"],
      "status": "needs-owner-confirmation",
      "classification": "public",
      "sources": [
        {
          "title": "InterlockGo LifeSafer page",
          "url": "https://interlockgo.io/lifesafer/",
          "authorityLevel": "3-interlockgo-policy",
          "verifiedOn": "2026-08-27"
        },
        {
          "title": "LifeSafer L250 device FAQ",
          "url": "https://www.lifesafer.com/lifesafer-l250-the-smallest-ignition-interlock-device-faqs/",
          "authorityLevel": "2-provider",
          "verifiedOn": "2026-08-27"
        }
      ]
    },
    {
      "provider": "Guardian",
      "models": ["AMS2500"],
      "status": "needs-owner-confirmation",
      "classification": "public",
      "sources": [
        {
          "title": "InterlockGo Guardian page",